{
  "deployment": {
    "edges": [
      {
        "evidence": [
          {
            "detail": "AddHostedService<GracePeriodManagerService>()",
            "type": "runtime"
          }
        ],
        "kind": "calls",
        "source": "csharp:csproj:src/OrderProcessor/OrderProcessor.csproj",
        "target": "deploy:image:GracePeriodManagerService"
      },
      {
        "evidence": [
          {
            "detail": "AddProject<Projects.OrderProcessor>().WithReference(rabbitMq)",
            "type": "runtime"
          }
        ],
        "kind": "calls",
        "source": "csharp:csproj:src/OrderProcessor/OrderProcessor.csproj",
        "target": "infra:queue:eventbus"
      },
      {
        "evidence": [
          {
            "detail": "AddProject<Projects.PaymentProcessor>().WithReference(rabbitMq)",
            "type": "runtime"
          }
        ],
        "kind": "calls",
        "source": "csharp:csproj:src/PaymentProcessor/PaymentProcessor.csproj",
        "target": "infra:queue:eventbus"
      },
      {
        "evidence": [
          {
            "detail": "AddProject<Projects.WebApp>().WithEnvironment(\"IdentityUrl\")",
            "type": "runtime"
          }
        ],
        "kind": "runtime_config",
        "source": "csharp:csproj:src/WebApp/WebApp.csproj",
        "target": "csharp:csproj:src/WebApp/WebApp.csproj"
      },
      {
        "evidence": [
          {
            "detail": "AddProject<Projects.WebApp>().WithReference(basketApi)",
            "type": "runtime"
          }
        ],
        "kind": "calls",
        "source": "csharp:csproj:src/WebApp/WebApp.csproj",
        "target": "deploy:image:basket-api"
      },
      {
        "evidence": [
          {
            "detail": "AddProject<Projects.WebApp>().WithReference(catalogApi)",
            "type": "runtime"
          }
        ],
        "kind": "calls",
        "source": "csharp:csproj:src/WebApp/WebApp.csproj",
        "target": "deploy:image:catalog-api"
      },
      {
        "evidence": [
          {
            "detail": "AddProject<Projects.WebApp>().WithReference(orderingApi)",
            "type": "runtime"
          }
        ],
        "kind": "calls",
        "source": "csharp:csproj:src/WebApp/WebApp.csproj",
        "target": "deploy:image:ordering-api"
      },
      {
        "evidence": [
          {
            "detail": "AddProject<Projects.WebApp>().WithReference(rabbitMq)",
            "type": "runtime"
          }
        ],
        "kind": "calls",
        "source": "csharp:csproj:src/WebApp/WebApp.csproj",
        "target": "infra:queue:eventbus"
      },
      {
        "evidence": [
          {
            "detail": "AddProject<Projects.WebhookClient>().WithEnvironment(\"IdentityUrl\")",
            "type": "runtime"
          }
        ],
        "kind": "runtime_config",
        "source": "csharp:csproj:src/WebhookClient/WebhookClient.csproj",
        "target": "csharp:csproj:src/WebhookClient/WebhookClient.csproj"
      },
      {
        "evidence": [
          {
            "detail": "AddProject<Projects.WebhookClient>().WithReference(webHooksApi)",
            "type": "runtime"
          }
        ],
        "kind": "calls",
        "source": "csharp:csproj:src/WebhookClient/WebhookClient.csproj",
        "target": "deploy:image:webhooks-api"
      },
      {
        "evidence": [
          {
            "detail": "AddProject<Projects.Basket_API>().WithEnvironment(\"Identity__Url\")",
            "type": "runtime"
          }
        ],
        "kind": "runtime_config",
        "source": "deploy:image:basket-api",
        "target": "deploy:image:basket-api"
      },
      {
        "evidence": [
          {
            "detail": "AddProject<Projects.Basket_API>().WithReference(redis)",
            "type": "runtime"
          }
        ],
        "kind": "calls",
        "source": "deploy:image:basket-api",
        "target": "infra:cache:redis"
      },
      {
        "evidence": [
          {
            "detail": "AddProject<Projects.Basket_API>().WithReference(rabbitMq)",
            "type": "runtime"
          }
        ],
        "kind": "calls",
        "source": "deploy:image:basket-api",
        "target": "infra:queue:eventbus"
      },
      {
        "evidence": [
          {
            "detail": "AddProject<Projects.Catalog_API>().WithReference(rabbitMq)",
            "type": "runtime"
          }
        ],
        "kind": "calls",
        "source": "deploy:image:catalog-api",
        "target": "infra:queue:eventbus"
      },
      {
        "evidence": [
          {
            "detail": "AddProject<Projects.Ordering_API>().WithEnvironment(\"Identity__Url\")",
            "type": "runtime"
          }
        ],
        "kind": "runtime_config",
        "source": "deploy:image:ordering-api",
        "target": "deploy:image:ordering-api"
      },
      {
        "evidence": [
          {
            "detail": "AddProject<Projects.Ordering_API>().WithReference(rabbitMq)",
            "type": "runtime"
          }
        ],
        "kind": "calls",
        "source": "deploy:image:ordering-api",
        "target": "infra:queue:eventbus"
      },
      {
        "evidence": [
          {
            "detail": "AddProject<Projects.Webhooks_API>().WithEnvironment(\"Identity__Url\")",
            "type": "runtime"
          }
        ],
        "kind": "runtime_config",
        "source": "deploy:image:webhooks-api",
        "target": "deploy:image:webhooks-api"
      },
      {
        "evidence": [
          {
            "detail": "AddProject<Projects.Webhooks_API>().WithReference(rabbitMq)",
            "type": "runtime"
          }
        ],
        "kind": "calls",
        "source": "deploy:image:webhooks-api",
        "target": "infra:queue:eventbus"
      }
    ],
    "nodes": [
      {
        "id": "deploy:image:GracePeriodManagerService",
        "kind": "image",
        "name": "GracePeriodManagerService",
        "tags": [
          "runtime:hosted-service"
        ]
      },
      {
        "id": "deploy:image:basket-api",
        "kind": "image",
        "name": "basket-api"
      },
      {
        "id": "deploy:image:catalog-api",
        "kind": "image",
        "name": "catalog-api"
      },
      {
        "id": "deploy:image:identity-api",
        "kind": "image",
        "name": "identity-api"
      },
      {
        "id": "deploy:image:ordering-api",
        "kind": "image",
        "name": "ordering-api"
      },
      {
        "id": "deploy:image:webhooks-api",
        "kind": "image",
        "name": "webhooks-api"
      },
      {
        "external": true,
        "id": "infra:cache:redis",
        "kind": "infra",
        "name": "redis",
        "subkind": "cache",
        "technology": "Redis"
      },
      {
        "external": true,
        "id": "infra:database:postgres",
        "kind": "infra",
        "name": "postgres",
        "subkind": "database",
        "technology": "PostgreSQL"
      },
      {
        "external": true,
        "id": "infra:queue:eventbus",
        "kind": "infra",
        "name": "eventbus",
        "subkind": "queue",
        "technology": "RabbitMQ"
      }
    ]
  },
  "provenance": {
    "boundary_promoted": 0,
    "commit": "9b4f9434f46fdc5c1a6e9e936af2868340cdbc48",
    "coverage": {
      "csharp:csproj:src/Basket.API/Basket.API.csproj": {
        "L0": true,
        "L1": false,
        "L2": false,
        "L3": false
      },
      "csharp:csproj:src/Catalog.API/Catalog.API.csproj": {
        "L0": true,
        "L1": false,
        "L2": false,
        "L3": false
      },
      "csharp:csproj:src/ClientApp/ClientApp.csproj": {
        "L0": true,
        "L1": false,
        "L2": true,
        "L3": false
      },
      "csharp:csproj:src/EventBus/EventBus.csproj": {
        "L0": true,
        "L1": false,
        "L2": false,
        "L3": false
      },
      "csharp:csproj:src/EventBusRabbitMQ/EventBusRabbitMQ.csproj": {
        "L0": true,
        "L1": false,
        "L2": false,
        "L3": false
      },
      "csharp:csproj:src/HybridApp/HybridApp.csproj": {
        "L0": true,
        "L1": false,
        "L2": false,
        "L3": false
      },
      "csharp:csproj:src/Identity.API/Identity.API.csproj": {
        "L0": true,
        "L1": false,
        "L2": false,
        "L3": false
      },
      "csharp:csproj:src/IntegrationEventLogEF/IntegrationEventLogEF.csproj": {
        "L0": true,
        "L1": false,
        "L2": false,
        "L3": false
      },
      "csharp:csproj:src/OrderProcessor/OrderProcessor.csproj": {
        "L0": true,
        "L1": false,
        "L2": false,
        "L3": false
      },
      "csharp:csproj:src/Ordering.API/Ordering.API.csproj": {
        "L0": true,
        "L1": false,
        "L2": false,
        "L3": false
      },
      "csharp:csproj:src/Ordering.Domain/Ordering.Domain.csproj": {
        "L0": true,
        "L1": false,
        "L2": false,
        "L3": false
      },
      "csharp:csproj:src/Ordering.Infrastructure/Ordering.Infrastructure.csproj": {
        "L0": true,
        "L1": false,
        "L2": false,
        "L3": false
      },
      "csharp:csproj:src/PaymentProcessor/PaymentProcessor.csproj": {
        "L0": true,
        "L1": false,
        "L2": false,
        "L3": false
      },
      "csharp:csproj:src/WebApp/WebApp.csproj": {
        "L0": true,
        "L1": false,
        "L2": false,
        "L3": false
      },
      "csharp:csproj:src/WebAppComponents/WebAppComponents.csproj": {
        "L0": true,
        "L1": false,
        "L2": false,
        "L3": false
      },
      "csharp:csproj:src/WebhookClient/WebhookClient.csproj": {
        "L0": true,
        "L1": false,
        "L2": false,
        "L3": false
      },
      "csharp:csproj:src/Webhooks.API/Webhooks.API.csproj": {
        "L0": true,
        "L1": false,
        "L2": false,
        "L3": false
      },